path	text	start	end	type	graphemes
/workspace/data/voice_recognition/keyword_detection/data_public_s2t_new/vivos/train/waves/VIVOSSPK01/VIVOSSPK01_T010.wav	thành thật chia buồn	0.0	2.375		th à nh | th ậ t | ch ia | b uồ n
/workspace/data/voice_recognition/keyword_detection/data_public_s2t_new/vin_keyword_set/vlsp2020_train_set_02/speaker_710-389147-1.wav	thứ tư chưa thống kê cụ thể được tài sản cá nhân của các thủy thủ bị cướp lấy đi	0.0	4.35		th ứ | t ư | ch ưa | th ố ng | k ê | c ụ | th ể | đ ượ c | t ài | s ả n | c á | nh â n | c ủa | c á c | th ủy | th ủ | b ị | c ướ p | l ấy | đ i
/workspace/data/voice_recognition/keyword_detection/data_public_s2t_new/vin_keyword_set/vlsp2020_train_set_02/database_sa1_Mar20_May04_cleaned_utt_0000048535-1.wav	bắt đầu đi xuân	0.0	1.42		b ắ t | đ ầu | đ i | x uâ n
/workspace/data/voice_recognition/keyword_detection/data_public_s2t_new/fpt_public_dataset/wav/FPTOpenSpeechData_Set002_V0.1_008101.wav	microsoft đã tốn khá nhiều thời gian vào việc bảo mật cho vista	0.0	4.632		m i c r o s o f t | đ ã | t ố n | kh á | nh iều | th ời | gi a n | v ào | v iệ c | b ảo | m ậ t | ch o | v i s t a
/workspace/data/voice_recognition/keyword_detection/data_public_s2t_new/fpt_public_dataset/wav/FPTOpenSpeechData_Set002_V0.1_010210.wav	nhưng như ông lộc phân tích thì trước tiên đây là việc chưa có tiền lệ 	0.0	4.944		nh ư ng | nh ư | ô ng | l ộ c | ph â n | t í ch | th ì | tr ướ c | t iê n | đ ây | l à | v iệ c | ch ưa | c ó | t iề n | l ệ
/workspace/data/voice_recognition/keyword_detection/data_public_s2t_new/vin_keyword_set/vlsp2020_train_set_02/speaker_383-115654-1.wav	tuy nhiên ông phần lớn dựa vào quân của lưu lao chi còn họ lưu thì không tin cậy tư mã nguyên hiển	0.0	7.81		t uy | nh iê n | ô ng | ph ầ n | l ớ n | d ựa | v ào | qu â n | c ủa | l ưu | l ao | ch i | c ò n | h ọ | l ưu | th ì | kh ô ng | t i n | c ậy | t ư | m ã | ng uyê n | h iể n
/workspace/data/voice_recognition/keyword_detection/data_public_s2t_new/vin_keyword_set/vlsp2020_train_set_02/database_sa1_Mar20_May04_cleaned_utt_0000068050-1.wav	thôi đi anh bị điên rồi hả	0.0	3.08		th ôi | đ i | a nh | b ị | đ iê n | r ồi | h ả
/workspace/data/voice_recognition/keyword_detection/data_public_s2t_new/vin_keyword_set/vlsp2020_train_set_02/database_sa2_Feb29_Mar06_Mar17_toApril06_cleaned_utt_0000123027-1.wav	bao gồm cả kênh liên triều và giữa quân đội với quân đội để giảm nguy cơ một sự hiểu lầm leo thang thành xung đột ông gu tê rớt nói trong khi tất cả những nước lo ngại tìm cách tránh vô tình leo thang căng thẳng dẫn đến xung đột	0.0	10.65		b ao | g ồ m | c ả | k ê nh | l iê n | tr iều | v à | gi ữa | qu â n | đ ội | v ới | qu â n | đ ội | đ ể | gi ả m | ng uy | c ơ | m ộ t | s ự | h iểu | l ầ m | l eo | th a ng | th à nh | x u ng | đ ộ t | ô ng | g u | t ê | r ớ t | n ói | tr o ng | kh i | t ấ t | c ả | nh ữ ng | n ướ c | l o | ng ại | t ì m | c á ch | tr á nh | v ô | t ì nh | l eo | th a ng | c ă ng | th ẳ ng | d ẫ n | đ ế n | x u ng | đ ộ t
/workspace/data/voice_recognition/keyword_detection/data_public_s2t_new/vivos/train/waves/VIVOSSPK06/VIVOSSPK06_R024.wav	những lúc rảnh rỗi	0.0	2.71875		nh ữ ng | l ú c | r ả nh | r ỗi
/workspace/data/voice_recognition/keyword_detection/data_public_s2t_new/vin_keyword_set/vlsp2020_train_set_02/database_sa2_Jan4_Feb29_cleaned_utt_0000121132-2.wav	trong một số trang goép như là trang web của bà su dan ni lơ và thấy có sáu tên của sáu người nước ngoài và không có tên người việt nam	0.0	5.27		tr o ng | m ộ t | s ố | tr a ng | g óe p | nh ư | l à | tr a ng | w e b | c ủa | b à | s u | d a n | n i | l ơ | v à | th ấy | c ó | s áu | t ê n | c ủa | s áu | ng ười | n ướ c | ng oài | v à | kh ô ng | c ó | t ê n | ng ười | v iệ t | n a m
/workspace/data/voice_recognition/keyword_detection/data_public_s2t_new/vin_keyword_set/vlsp2020_train_set_02/speaker_047-041752-1.wav	tuy nhiên khi máy phát điện được nối vào một lưới có công suất rất lớn so với máy phát việc tăng giảm dòng kích thích hầu như không làm thay đổi điện áp lưới	0.0	10.37		t uy | nh iê n | kh i | m áy | ph á t | đ iệ n | đ ượ c | n ối | v ào | m ộ t | l ưới | c ó | c ô ng | s uấ t | r ấ t | l ớ n | s o | v ới | m áy | ph á t | v iệ c | t ă ng | gi ả m | d ò ng | k í ch | th í ch | h ầu | nh ư | kh ô ng | l à m | th ay | đ ổi | đ iệ n | á p | l ưới
/workspace/data/voice_recognition/keyword_detection/data_public_s2t_new/vin_keyword_set/vlsp2020_train_set_02/database_sa2_Feb29_Mar06_Mar17_toApril06_cleaned_utt_0000097596-1.wav	vâng và bây giờ chính bạn cũng hình như không chắc chắn lắm	0.0	4.89		v â ng | v à | b ây | gi ờ | ch í nh | b ạ n | c ũ ng | h ì nh | nh ư | kh ô ng | ch ắ c | ch ắ n | l ắ m
/workspace/data/voice_recognition/keyword_detection/data_public_s2t_new/vivos/train/waves/VIVOSSPK07/VIVOSSPK07_R004.wav	nhưng chân tôi còn ngắn	0.0	3.25		nh ư ng | ch â n | t ôi | c ò n | ng ắ n
/workspace/data/voice_recognition/keyword_detection/data_public_s2t_new/vin_keyword_set/vlsp2020_train_set_02/database_sa4_2019-01-08_2020-03-16_cleaned_utt_0000047657-1.wav	làm thế nào để có chất lượng giáo dục tốt trong khi cơ sở vật chất của chúng ta còn nhiều hạn chế	0.0	4.75		l à m | th ế | n ào | đ ể | c ó | ch ấ t | l ượ ng | gi áo | d ụ c | t ố t | tr o ng | kh i | c ơ | s ở | v ậ t | ch ấ t | c ủa | ch ú ng | t a | c ò n | nh iều | h ạ n | ch ế
/workspace/data/voice_recognition/keyword_detection/data_public_s2t_new/fpt_public_dataset/wav/FPTOpenSpeechData_Set002_V0.1_009100.wav	nay việc kiểm chứng trở nên khó khăn phản ứng kịp thời đó không có 	0.0	5.736		n ay | v iệ c | k iể m | ch ứ ng | tr ở | n ê n | kh ó | kh ă n | ph ả n | ứ ng | k ị p | th ời | đ ó | kh ô ng | c ó
/workspace/data/voice_recognition/keyword_detection/data_public_s2t_new/vivos/train/waves/VIVOSSPK33/VIVOSSPK33_160.wav	hãy luôn cố gắng để đạt được ước mơ nghề nghiệp của mình bạn nhé	0.0	5.75		h ãy | l uô n | c ố | g ắ ng | đ ể | đ ạ t | đ ượ c | ướ c | m ơ | ngh ề | ngh iệ p | c ủa | m ì nh | b ạ n | nh é
/workspace/data/voice_recognition/keyword_detection/data_public_s2t_new/vin_keyword_set/vlsp2020_train_set_02/database_sa3_1_150h_15Jan2020_cleaned_utt_0000005205-1.wav	a lô vê tê xê mười sáu xin nghe ạ	0.0	2.04		a | l ô | v ê | t ê | x ê | m ười | s áu | x i n | ngh e | ạ
/workspace/data/voice_recognition/keyword_detection/data_public_s2t_new/vin_keyword_set/vlsp2020_train_set_02/database_sa2_Feb29_Mar06_Mar17_toApril06_cleaned_utt_0000179450-1.wav	thế là chả ai biết em là khỉ hay là khỉ là em nữa đúng không ạ	0.0	4.81		th ế | l à | ch ả | ai | b iế t | e m | l à | kh ỉ | h ay | l à | kh ỉ | l à | e m | n ữa | đ ú ng | kh ô ng | ạ
/workspace/data/voice_recognition/keyword_detection/data_public_s2t_new/vin_keyword_set/vlsp2020_train_set_02/database_sa4_Mar17_toApril11_cleaned_utt_0000113466-1.wav	là chứng minh là người vợ người chồng khi tới đây là đã có bảo hiểm trong vòng ba mươi ngày chứ không phải là bước chân vào mỹ rồi mới mua	0.0	6.68		l à | ch ứ ng | m i nh | l à | ng ười | v ợ | ng ười | ch ồ ng | kh i | t ới | đ ây | l à | đ ã | c ó | b ảo | h iể m | tr o ng | v ò ng | b a | m ươi | ng ày | ch ứ | kh ô ng | ph ải | l à | b ướ c | ch â n | v ào | m ỹ | r ồi | m ới | m ua
/workspace/data/voice_recognition/keyword_detection/data_public_s2t_new/vivos/train/waves/VIVOSSPK02/VIVOSSPK02_R124.wav	khi bạn cố gắng để thay đổi những người khác	0.0	3.9375		kh i | b ạ n | c ố | g ắ ng | đ ể | th ay | đ ổi | nh ữ ng | ng ười | kh á c
/workspace/data/voice_recognition/keyword_detection/data_public_s2t_new/vin_keyword_set/vlsp2020_train_set_02/database_sa3_Jan21_Apr24_cleaned_utt_0000061701-1.wav	mỗi nội dung gồm mười đội thi đấu sau lễ khai mạc các đội tiến hành thi đấu các trận vòng bảng ngày hai mươi mốt tháng bảy bắt đầu vào vòng đấu loại trực tiếp	0.0	7.5		m ỗi | n ội | d u ng | g ồ m | m ười | đ ội | th i | đ ấu | s au | l ễ | kh ai | m ạ c | c á c | đ ội | t iế n | h à nh | th i | đ ấu | c á c | tr ậ n | v ò ng | b ả ng | ng ày | h ai | m ươi | m ố t | th á ng | b ảy | b ắ t | đ ầu | v ào | v ò ng | đ ấu | l oại | tr ự c | t iế p
/workspace/data/voice_recognition/keyword_detection/data_public_s2t_new/vivos/train/waves/VIVOSSPK19/VIVOSSPK19_197.wav	và đây là khu vực dân cư lao động nghèo	0.0	3.90625		v à | đ ây | l à | kh u | v ự c | d â n | c ư | l ao | đ ộ ng | ngh èo
/workspace/data/voice_recognition/keyword_detection/data_public_s2t_new/vin_keyword_set/vlsp2020_train_set_02/database_sa3_Jan21_Apr24_cleaned_utt_0000024091-1.wav	chúng tôi định chuyển tới vào cuối tháng này	0.0	2.6		ch ú ng | t ôi | đ ị nh | ch uyể n | t ới | v ào | c uối | th á ng | n ày
/workspace/data/voice_recognition/keyword_detection/data_public_s2t_new/vin_keyword_set/vlsp2020_train_set_02/speaker_024-018359-1.wav	giáo sư ngô bảo châu từng được trao nhiều giải thưởng toán học uy tín thế giới như	0.0	5.12		gi áo | s ư | ng ô | b ảo | ch âu | t ừ ng | đ ượ c | tr ao | nh iều | gi ải | th ưở ng | t óa n | h ọ c | uy | t í n | th ế | gi ới | nh ư
/workspace/data/voice_recognition/keyword_detection/data_public_s2t_new/vin_keyword_set/vlsp2020_train_set_02/database_sa2_Feb29_Mar06_Mar17_toApril06_cleaned_utt_0000084809-1.wav	lúc nãy có khoe là sẽ ra một em vi rồi còn gì nữa không ạ	0.0	3.01		l ú c | n ãy | c ó | kh oe | l à | s ẽ | r a | m ộ t | e m | v i | r ồi | c ò n | gì | n ữa | kh ô ng | ạ
/workspace/data/voice_recognition/keyword_detection/data_public_s2t_new/vin_keyword_set/vlsp2020_train_set_02/spkyut-20190730-utt000001888.wav	người luôn có thời gian rảnh sẽ rất khó thành công còn người lúc nào cũng bận rộn mới có nhiều cơ hội để thành công	0.0	8.741		ng ười | l uô n | c ó | th ời | gi a n | r ả nh | s ẽ | r ấ t | kh ó | th à nh | c ô ng | c ò n | ng ười | l ú c | n ào | c ũ ng | b ậ n | r ộ n | m ới | c ó | nh iều | c ơ | h ội | đ ể | th à nh | c ô ng
/workspace/data/voice_recognition/keyword_detection/data_public_s2t_new/fpt_public_dataset/wav/FPTOpenSpeechData_Set001_V0.1_000385.wav	mặc dù có vẻ ghê gớm bạn rất sợ bị tổn	0.0	3.672		m ặ c | d ù | c ó | v ẻ | gh ê | g ớ m | b ạ n | r ấ t | s ợ | b ị | t ổ n
/workspace/data/voice_recognition/keyword_detection/data_public_s2t_new/vin_keyword_set/vlsp2020_train_set_02/spkyut-20190730-utt000001082.wav	hollywood là biểu tượng của những giấc mơ trở thành sự thật vì hàng ngàn người mang theo hy vọng đã chuyển đến los angeles để theo đuổi sự nghiệp ở vùng đất giải trí	0.0	8.332		h o l l y w oo d | l à | b iểu | t ượ ng | c ủa | nh ữ ng | gi ấ c | m ơ | tr ở | th à nh | s ự | th ậ t | v ì | h à ng | ng à n | ng ười | m a ng | th eo | h y | v ọ ng | đ ã | ch uyể n | đ ế n | l o s | a ng e l e s | đ ể | th eo | đ uổi | s ự | ngh iệ p | ở | v ù ng | đ ấ t | gi ải | tr í
/workspace/data/voice_recognition/keyword_detection/data_public_s2t_new/vivos/train/waves/VIVOSSPK01/VIVOSSPK01_R119.wav	khi tên lửa bay lên	0.0	2.46875		kh i | t ê n | l ửa | b ay | l ê n
/workspace/data/voice_recognition/keyword_detection/data_public_s2t_new/fpt_public_dataset/wav/FPTOpenSpeechData_Set002_V0.1_002646.wav	nhóm cổ phiếu công nghệ bứt phá mạnh nhất thị trường với sự dẫn đầu của cisco	0.0	7.272		nh ó m | c ổ | ph iếu | c ô ng | ngh ệ | b ứ t | ph á | m ạ nh | nh ấ t | th ị | tr ườ ng | v ới | s ự | d ẫ n | đ ầu | c ủa | c i s c o
/workspace/data/voice_recognition/keyword_detection/data_public_s2t_new/common_voice/cv-corpus-8.0-2022-01-19/vi/clips/common_voice_vi_24171786.wav	sao trời linh thế	0.0	3.708		s ao | tr ời | l i nh | th ế
/workspace/data/voice_recognition/keyword_detection/data_public_s2t_new/common_voice/cv-corpus-8.0-2022-01-19/vi/clips/common_voice_vi_24144153.wav	mày sẽ đưa tao đi cùng khắp mọi nơi	0.0	4.5		m ày | s ẽ | đ ưa | t ao | đ i | c ù ng | kh ắ p | m ọi | n ơi
/workspace/data/voice_recognition/keyword_detection/data_public_s2t_new/fpt_public_dataset/wav/FPTOpenSpeechData_Set001_V0.1_010713.wav	cách nhà bạn bao xa	0.0	1.488		c á ch | nh à | b ạ n | b ao | x a
/workspace/data/voice_recognition/keyword_detection/data_public_s2t_new/vin_keyword_set/vlsp2020_train_set_02/database_sa4_Mar17_toApril11_cleaned_utt_0000024981-1.wav	chủ tịch ủy ban nhân dân thành phố hà nội xin cam kết như sau một trực tiếp kiểm tra đoàn thanh tra chỉ đạo sát sao làm đúng sự thật khách quan và đúng pháp luật khu vực đất đồng sênh rõ ràng đâu là đất quốc phòng đâu là đất nông nghiệp không mập mờ đảm bảo đúng quyền lợi cho nhân dân đồng tâm theo quy định của pháp luật	0.0	27.56		ch ủ | t ị ch | ủy | b a n | nh â n | d â n | th à nh | ph ố | h à | n ội | x i n | c a m | k ế t | nh ư | s au | m ộ t | tr ự c | t iế p | k iể m | tr a | đ òa n | th a nh | tr a | ch ỉ | đ ạo | s á t | s ao | l à m | đ ú ng | s ự | th ậ t | kh á ch | qu a n | v à | đ ú ng | ph á p | l uậ t | kh u | v ự c | đ ấ t | đ ồ ng | s ê nh | r õ | r à ng | đ âu | l à | đ ấ t | qu ố c | ph ò ng | đ âu | l à | đ ấ t | n ô ng | ngh iệ p | kh ô ng | m ậ p | m ờ | đ ả m | b ảo | đ ú ng | qu yề n | l ợi | ch o | nh â n | d â n | đ ồ ng | t â m | th eo | qu y | đ ị nh | c ủa | ph á p | l uậ t
/workspace/data/voice_recognition/keyword_detection/data_public_s2t_new/vivos/train/waves/VIVOSSPK05/VIVOSSPK05_T010.wav	người miền bắc cứ hễ yêu ai là bắt phải về nhà ra mắt	0.0	4.3125		ng ười | m iề n | b ắ c | c ứ | h ễ | yêu | ai | l à | b ắ t | ph ải | v ề | nh à | r a | m ắ t
/workspace/data/voice_recognition/keyword_detection/data_public_s2t_new/vivos/train/waves/VIVOSSPK32/VIVOSSPK32_087.wav	có bốn người trong số tám sáng lập viên của nhóm đã quyết định công khai danh tánh của mình	0.0	7.5		c ó | b ố n | ng ười | tr o ng | s ố | t á m | s á ng | l ậ p | v iê n | c ủa | nh ó m | đ ã | qu yế t | đ ị nh | c ô ng | kh ai | d a nh | t á nh | c ủa | m ì nh
/workspace/data/voice_recognition/keyword_detection/data_public_s2t_new/vin_keyword_set/vlsp2020_train_set_02/database_sa1_Jan08_Mar19_cleaned_utt_0000021169-1.wav	không hẳn là đứng đầu trong cuộc chơi của nó ngay bây giờ nhưng nó cũng không chỉ là một cái bóng của phiên bản trước đây	0.0	5.73		kh ô ng | h ẳ n | l à | đ ứ ng | đ ầu | tr o ng | c uộ c | ch ơi | c ủa | n ó | ng ay | b ây | gi ờ | nh ư ng | n ó | c ũ ng | kh ô ng | ch ỉ | l à | m ộ t | c ái | b ó ng | c ủa | ph iê n | b ả n | tr ướ c | đ ây
/workspace/data/voice_recognition/keyword_detection/data_public_s2t_new/vin_keyword_set/vlsp2020_train_set_02/database_sa2_Feb29_Mar06_Mar17_toApril06_cleaned_utt_0000061193-1.wav	hóa ra là nó lấy anh em mình để diễn thử kịch bản phim mới à	0.0	3.76		h óa | r a | l à | n ó | l ấy | a nh | e m | m ì nh | đ ể | d iễ n | th ử | k ị ch | b ả n | ph i m | m ới | à
/workspace/data/voice_recognition/keyword_detection/data_public_s2t_new/vin_keyword_set/vlsp2020_train_set_02/speaker_613-059770-1.wav	vì lẽ đó nhà thiết kế kiêm biểu tượng thời trang ăn vận rất đơn giản	0.0	3.9		v ì | l ẽ | đ ó | nh à | th iế t | k ế | k iê m | b iểu | t ượ ng | th ời | tr a ng | ă n | v ậ n | r ấ t | đ ơ n | gi ả n
/workspace/data/voice_recognition/keyword_detection/data_public_s2t_new/vin_keyword_set/vlsp2020_train_set_02/database_sa2_Jan4_Feb29_cleaned_utt_0000025197-1.wav	hay các đại hội thể thao luôn được đặt lên hàng đầu	0.0	2.13		h ay | c á c | đ ại | h ội | th ể | th ao | l uô n | đ ượ c | đ ặ t | l ê n | h à ng | đ ầu
/workspace/data/voice_recognition/keyword_detection/data_public_s2t_new/fpt_public_dataset/wav/FPTOpenSpeechData_Set002_V0.1_003482.wav	cái loại kem này có thể dùng được cho cả ngày và đêm không	0.0	4.128		c ái | l oại | k e m | n ày | c ó | th ể | d ù ng | đ ượ c | ch o | c ả | ng ày | v à | đ ê m | kh ô ng
/workspace/data/voice_recognition/keyword_detection/data_public_s2t_new/fpt_public_dataset/wav/FPTOpenSpeechData_Set001_V0.1_012500.wav	ba vũ nuôi rắn ri voi nổi tiếng từ đó	0.0	4.68		b a | v ũ | n uôi | r ắ n | r i | v oi | n ổi | t iế ng | t ừ | đ ó
/workspace/data/voice_recognition/keyword_detection/data_public_s2t_new/vin_keyword_set/vlsp2020_train_set_02/speaker_748-087264-1.wav	việc điều hành lãi suất tỷ giá và tăng trưởng tín dụng có gắn bó mật thiết với nhau	0.0	5.35		v iệ c | đ iều | h à nh | l ãi | s uấ t | t ỷ | gi á | v à | t ă ng | tr ưở ng | t í n | d ụ ng | c ó | g ắ n | b ó | m ậ t | th iế t | v ới | nh au
/workspace/data/voice_recognition/keyword_detection/data_public_s2t_new/vin_keyword_set/vlsp2020_train_set_02/database_sa1_Mar20_May04_cleaned_utt_0000027198-1.wav	dạ là một không tám chín	0.0	4.02		d ạ | l à | m ộ t | kh ô ng | t á m | ch í n
/workspace/data/voice_recognition/keyword_detection/data_public_s2t_new/fpt_public_dataset/wav/FPTOpenSpeechData_Set001_V0.1_003965.wav	tối cứ ngủ lơ mơ vì lo làm không có cá	0.0	4.416		t ối | c ứ | ng ủ | l ơ | m ơ | v ì | l o | l à m | kh ô ng | c ó | c á
/workspace/data/voice_recognition/keyword_detection/data_public_s2t_new/vin_keyword_set/vlsp2020_train_set_02/speaker_523-114491-1.wav	ba tôi thường xuyên đánh đập và chửi bới mẹ	0.0	4.34		b a | t ôi | th ườ ng | x uyê n | đ á nh | đ ậ p | v à | ch ửi | b ới | m ẹ
/workspace/data/voice_recognition/keyword_detection/data_public_s2t_new/vin_keyword_set/vlsp2020_train_set_02/database_sa4_2019-01-08_2020-03-16_cleaned_utt_0000023584-1.wav	với sóng biển dâng cao tình hình xâm thực và sạt lở khu vực bờ biển diễn ra ngày càng nghiêm trọng trong đó có nhiều điểm ăn sâu vào tuyến đường giao thông tỉnh lộ hai mươi mốt thuộc các xã ven biển của huyện phú lộc nối từ vinh hưng đi vinh hiền vì vậy về lâu dài tỉnh thừa thiên huế cần sớm lập dự án bố trí vốn và có phương án xử lý kịp thời nếu không tuyến đường này sẽ tiếp tục bị sóng biển uy hiếp và gây sạt lở	0.0	22.13		v ới | s ó ng | b iể n | d â ng | c ao | t ì nh | h ì nh | x â m | th ự c | v à | s ạ t | l ở | kh u | v ự c | b ờ | b iể n | d iễ n | r a | ng ày | c à ng | ngh iê m | tr ọ ng | tr o ng | đ ó | c ó | nh iều | đ iể m | ă n | s âu | v ào | t uyế n | đ ườ ng | gi ao | th ô ng | t ỉ nh | l ộ | h ai | m ươi | m ố t | th uộ c | c á c | x ã | v e n | b iể n | c ủa | h uyệ n | ph ú | l ộ c | n ối | t ừ | v i nh | h ư ng | đ i | v i nh | h iề n | v ì | v ậy | v ề | l âu | d ài | t ỉ nh | th ừa | th iê n | h uế | c ầ n | s ớ m | l ậ p | d ự | á n | b ố | tr í | v ố n | v à | c ó | ph ươ ng | á n | x ử | l ý | k ị p | th ời | n ếu | kh ô ng | t uyế n | đ ườ ng | n ày | s ẽ | t iế p | t ụ c | b ị | s ó ng | b iể n | uy | h iế p | v à | g ây | s ạ t | l ở
/workspace/data/voice_recognition/keyword_detection/data_public_s2t_new/vin_keyword_set/vlsp2020_train_set_02/database_sa4_Mar17_toApril11_cleaned_utt_0000010541-2.wav	khi bây giờ chúng ta có thể nhìn thấy hai người đang cùng có số điểm cao nhất và đồng dẫn đầu đoàn leo núi của chúng ta người tiếp sau đó chỉ kém có mười điểm và người tiếp theo kém ba	0.0	8.46		kh i | b ây | gi ờ | ch ú ng | t a | c ó | th ể | nh ì n | th ấy | h ai | ng ười | đ a ng | c ù ng | c ó | s ố | đ iể m | c ao | nh ấ t | v à | đ ồ ng | d ẫ n | đ ầu | đ òa n | l eo | n úi | c ủa | ch ú ng | t a | ng ười | t iế p | s au | đ ó | ch ỉ | k é m | c ó | m ười | đ iể m | v à | ng ười | t iế p | th eo | k é m | b a
/workspace/data/voice_recognition/keyword_detection/data_public_s2t_new/vin_keyword_set/vlsp2020_train_set_02/database_sa1_Mar20_May04_cleaned_utt_0000032390-1.wav	người yêu em á gia đình cũng	0.0	1.45		ng ười | yêu | e m | á | gi a | đ ì nh | c ũ ng
/workspace/data/voice_recognition/keyword_detection/data_public_s2t_new/common_voice/cv-corpus-8.0-2022-01-19/vi/clips/common_voice_vi_24172733.wav	để cho em cứ vấn vương	0.0	3.78		đ ể | ch o | e m | c ứ | v ấ n | v ươ ng
/workspace/data/voice_recognition/keyword_detection/data_public_s2t_new/vivos/train/waves/VIVOSSPK41/VIVOSSPK41_052.wav	nhiều đơn vị địa phương đã mạnh dạn đề xuất hình thức khoán xe công	0.0	3.811875		nh iều | đ ơ n | v ị | đ ịa | ph ươ ng | đ ã | m ạ nh | d ạ n | đ ề | x uấ t | h ì nh | th ứ c | kh óa n | x e | c ô ng
/workspace/data/voice_recognition/keyword_detection/data_public_s2t_new/vin_keyword_set/vlsp2020_train_set_02/database_sa4_Mar17_toApril11_cleaned_utt_0000015070-1.wav	những	0.0	0.88		nh ữ ng
/workspace/data/voice_recognition/keyword_detection/data_public_s2t_new/vin_keyword_set/vlsp2020_train_set_02/database_sa4_Mar17_toApril11_cleaned_utt_0000046262-1.wav	và cho chiếc đinh thẳng vào cốc nước có ga ngâm chiếc đinh cong trong nước cất ngâm chiếc đinh thẳng trong nước có ga sau năm phút ta nhấc hai chiếc đinh lên	0.0	8.47		v à | ch o | ch iế c | đ i nh | th ẳ ng | v ào | c ố c | n ướ c | c ó | g a | ng â m | ch iế c | đ i nh | c o ng | tr o ng | n ướ c | c ấ t | ng â m | ch iế c | đ i nh | th ẳ ng | tr o ng | n ướ c | c ó | g a | s au | n ă m | ph ú t | t a | nh ấ c | h ai | ch iế c | đ i nh | l ê n
/workspace/data/voice_recognition/keyword_detection/data_public_s2t_new/vivos/train/waves/VIVOSSPK38/VIVOSSPK38_218.wav	má ba chết đi kéo theo một số cái chết nghiệt ngã khác trong đại gia đình của tôi anh tôi ba tôi rồi bà nội của tôi	0.0	9.625		m á | b a | ch ế t | đ i | k éo | th eo | m ộ t | s ố | c ái | ch ế t | ngh iệ t | ng ã | kh á c | tr o ng | đ ại | gi a | đ ì nh | c ủa | t ôi | a nh | t ôi | b a | t ôi | r ồi | b à | n ội | c ủa | t ôi
/workspace/data/voice_recognition/keyword_detection/data_public_s2t_new/vivos/train/waves/VIVOSSPK01/VIVOSSPK01_T028.wav	đàn bà chỉ cần một thứ	0.0	2.75		đ à n | b à | ch ỉ | c ầ n | m ộ t | th ứ
/workspace/data/voice_recognition/keyword_detection/data_public_s2t_new/vin_keyword_set/vlsp2020_train_set_02/speaker_612-104570-1.wav	nhưng chỉ tủi thân thôi thì sẽ không thay đổi được gì cả	0.0	5.33		nh ư ng | ch ỉ | t ủi | th â n | th ôi | th ì | s ẽ | kh ô ng | th ay | đ ổi | đ ượ c | gì | c ả
/workspace/data/voice_recognition/keyword_detection/data_public_s2t_new/vin_keyword_set/vlsp2020_train_set_02/speaker_051-000539-1.wav	tướng tần vương cẩu sanh đem thành tất khâu hàng vương trấn ác thứ sử từ châu diêu chưởng ở hạng thành cũng đầu hàng đàn đạo tế	0.0	9.4995		t ướ ng | t ầ n | v ươ ng | c ẩu | s a nh | đ e m | th à nh | t ấ t | kh âu | h à ng | v ươ ng | tr ấ n | á c | th ứ | s ử | t ừ | ch âu | d iêu | ch ưở ng | ở | h ạ ng | th à nh | c ũ ng | đ ầu | h à ng | đ à n | đ ạo | t ế
/workspace/data/voice_recognition/keyword_detection/data_public_s2t_new/vin_keyword_set/vlsp2020_train_set_02/speaker_759-380192-1.wav	da vùng trán của thanh niên này bị rách để lộ một phần hộp sọ	0.0	4.16		d a | v ù ng | tr á n | c ủa | th a nh | n iê n | n ày | b ị | r á ch | đ ể | l ộ | m ộ t | ph ầ n | h ộ p | s ọ
/workspace/data/voice_recognition/keyword_detection/data_public_s2t_new/fpt_public_dataset/wav/FPTOpenSpeechData_Set001_V0.1_003176.wav	việc bổ sung một số vi chất qua chế độ ăn giúp khắc phục điều này	0.0	4.992		v iệ c | b ổ | s u ng | m ộ t | s ố | v i | ch ấ t | qu a | ch ế | đ ộ | ă n | gi ú p | kh ắ c | ph ụ c | đ iều | n ày
/workspace/data/voice_recognition/keyword_detection/data_public_s2t_new/vin_keyword_set/vlsp2020_train_set_02/database_sa4_Mar17_toApril11_cleaned_utt_0000099350-1.wav	mệt	0.0	1.24		m ệ t
