path	text	start	end	type	graphemes
/workspace/data/voice_recognition/keyword_detection/data_public_s2t_new/fpt_public_dataset/wav/FPTOpenSpeechData_Set001_V0.1_002125.wav	hôm nay trời rất nóng	0.0	1.344		h ô m | n ay | tr ời | r ấ t | n ó ng
/workspace/data/voice_recognition/keyword_detection/data_public_s2t_new/vin_keyword_set/vlsp2020_train_set_02/database_sa2_Feb29_Mar06_Mar17_toApril06_cleaned_utt_0000019729-1.wav	trong chương trình đặc biệt hôm nay vi ô ây tìm hiểu xem sáng kiến vành đai và con đường đang biến đổi đời sống định hình lại cảnh quan và thay đổi cục diện địa chính trị ra sao mời quý vị theo dõi	0.0	10.11		tr o ng | ch ươ ng | tr ì nh | đ ặ c | b iệ t | h ô m | n ay | v i | ô | ây | t ì m | h iểu | x e m | s á ng | k iế n | v à nh | đ ai | v à | c o n | đ ườ ng | đ a ng | b iế n | đ ổi | đ ời | s ố ng | đ ị nh | h ì nh | l ại | c ả nh | qu a n | v à | th ay | đ ổi | c ụ c | d iệ n | đ ịa | ch í nh | tr ị | r a | s ao | m ời | qu ý | v ị | th eo | d õi
/workspace/data/voice_recognition/keyword_detection/data_public_s2t_new/fpt_public_dataset/wav/FPTOpenSpeechData_Set001_V0.1_004676.wav	một bức biếm họa mô tả nhà tiên tri là con lừa vừa uống bia vừa đi tiểu tiện	0.0	6.096		m ộ t | b ứ c | b iế m | h ọa | m ô | t ả | nh à | t iê n | tr i | l à | c o n | l ừa | v ừa | uố ng | b ia | v ừa | đ i | t iểu | t iệ n
/workspace/data/voice_recognition/keyword_detection/data_public_s2t_new/vin_keyword_set/vlsp2020_train_set_02/speaker_647-044434-1.wav	do đơn vị còn khó khăn nên đang áp dụng biện pháp tiết kiệm chi tiêu ông hoạch nói	0.0	7.77		d o | đ ơ n | v ị | c ò n | kh ó | kh ă n | n ê n | đ a ng | á p | d ụ ng | b iệ n | ph á p | t iế t | k iệ m | ch i | t iêu | ô ng | h ọa ch | n ói
/workspace/data/voice_recognition/keyword_detection/data_public_s2t_new/vin_keyword_set/vlsp2020_train_set_02/database_sa2_Jan4_Feb29_cleaned_utt_0000002079-1.wav	phiên họp ba sáu của ủy ban thường vụ quốc hội đã bắt đầu diễn ra sáng nay và kéo dài đến ngày mười sáu tháng tám đáng chú ý vào ngày mười lăm tháng tám sẽ diễn ra phiên chất vấn và trả lời chất vấn được phát thanh truyền hình trực tiếp để cử tri cả nước theo dõi	0.0	12.39		ph iê n | h ọ p | b a | s áu | c ủa | ủy | b a n | th ườ ng | v ụ | qu ố c | h ội | đ ã | b ắ t | đ ầu | d iễ n | r a | s á ng | n ay | v à | k éo | d ài | đ ế n | ng ày | m ười | s áu | th á ng | t á m | đ á ng | ch ú | ý | v ào | ng ày | m ười | l ă m | th á ng | t á m | s ẽ | d iễ n | r a | ph iê n | ch ấ t | v ấ n | v à | tr ả | l ời | ch ấ t | v ấ n | đ ượ c | ph á t | th a nh | tr uyề n | h ì nh | tr ự c | t iế p | đ ể | c ử | tr i | c ả | n ướ c | th eo | d õi
/workspace/data/voice_recognition/keyword_detection/data_public_s2t_new/fpt_public_dataset/wav/FPTOpenSpeechData_Set001_V0.1_012275.wav	tôi có chút rượu 	0.0	1.416		t ôi | c ó | ch ú t | r ượu
/workspace/data/voice_recognition/keyword_detection/data_public_s2t_new/vin_keyword_set/vlsp2020_train_set_02/speaker_343-063153-1.wav	nhìn bán diện rìa mái cuộn lên ở hai đầu như hình ảnh một chiếc thuyền rồng ngoại mục	0.0	6.23		nh ì n | b á n | d iệ n | r ìa | m ái | c uộ n | l ê n | ở | h ai | đ ầu | nh ư | h ì nh | ả nh | m ộ t | ch iế c | th uyề n | r ồ ng | ng oại | m ụ c
/workspace/data/voice_recognition/keyword_detection/data_public_s2t_new/fpt_public_dataset/wav/FPTOpenSpeechData_Set002_V0.1_000763.wav	nhưng phong tục này chưa hẳn đã thích hợp khi đến châu âu 	0.0	7.176		nh ư ng | ph o ng | t ụ c | n ày | ch ưa | h ẳ n | đ ã | th í ch | h ợ p | kh i | đ ế n | ch âu | âu
/workspace/data/voice_recognition/keyword_detection/data_public_s2t_new/fpt_public_dataset/wav/FPTOpenSpeechData_Set001_V0.1_000338.wav	tôi sẽ ở nhà một người bạn tại new york 	0.0	2.904		t ôi | s ẽ | ở | nh à | m ộ t | ng ười | b ạ n | t ại | n e w | y o r k
/workspace/data/voice_recognition/keyword_detection/data_public_s2t_new/vin_keyword_set/vlsp2020_train_set_02/database_sa2_Jan4_Feb29_cleaned_utt_0000040784-1.wav	theo đó cơ quan bảo hiểm xã hội sẽ cập nhật tình hình nhân sự và mức tăng giảm đóng bảo hiểm xã hội cho người lao động	0.0	5.7		th eo | đ ó | c ơ | qu a n | b ảo | h iể m | x ã | h ội | s ẽ | c ậ p | nh ậ t | t ì nh | h ì nh | nh â n | s ự | v à | m ứ c | t ă ng | gi ả m | đ ó ng | b ảo | h iể m | x ã | h ội | ch o | ng ười | l ao | đ ộ ng
/workspace/data/voice_recognition/keyword_detection/data_public_s2t_new/vin_keyword_set/vlsp2020_train_set_02/database_sa2_Jan4_Feb29_cleaned_utt_0000013007-1.wav	việc nghiên cứu tiếp cận và phổ biến những công nghệ giáo dục mới phương thức giáo dục mới cho toàn hệ thống	0.0	5.71		v iệ c | ngh iê n | c ứu | t iế p | c ậ n | v à | ph ổ | b iế n | nh ữ ng | c ô ng | ngh ệ | gi áo | d ụ c | m ới | ph ươ ng | th ứ c | gi áo | d ụ c | m ới | ch o | t òa n | h ệ | th ố ng
/workspace/data/voice_recognition/keyword_detection/data_public_s2t_new/fpt_public_dataset/wav/FPTOpenSpeechData_Set002_V0.1_004000.wav	nhưng trên thực tế việc cắt giảm không được bao nhiêu 	0.0	5.712		nh ư ng | tr ê n | th ự c | t ế | v iệ c | c ắ t | gi ả m | kh ô ng | đ ượ c | b ao | nh iêu
/workspace/data/voice_recognition/keyword_detection/data_public_s2t_new/fpt_public_dataset/wav/FPTOpenSpeechData_Set001_V0.1_005137.wav	nó sẽ giúp tài xế khắc phục việc tình huống và đạp nhầm khi xử lý tình huống	0.0	5.472		n ó | s ẽ | gi ú p | t ài | x ế | kh ắ c | ph ụ c | v iệ c | t ì nh | h uố ng | v à | đ ạ p | nh ầ m | kh i | x ử | l ý | t ì nh | h uố ng
